{
  "artifact_id": "simcorrect-problem1-forearm",
  "created_at": "2026-04-24T00:00:00Z",
  "feature_tree": {
    "nodes": {},
    "root_id": "root"
  },
  "parameters": {
    "forearm_length": {
      "feature_id": "feat-forearm",
      "name": "forearm_length",
      "role": "geometry",
      "unit": "m",
      "value": 0.25
    }
  },
  "producer": {
    "name": "opencad",
    "version": "0.1.1"
  },
  "schema_version": 1,
  "simulation_tags": [
    {
      "kind": "parameter",
      "name": "forearm_length",
      "target": "link2_length"
    }
  ]
}
